{"components":[{"id":"INF.PWR_ENTRY.VP15","kind":"voltage_source","model_bindings":{"ideal":"MODEL.W09.V.I"},"module_id":"INF.PWR_ENTRY","parameters":{"physical_supply_detail":"separate permanent infrastructure sheet","role":"ideal simulation rail source"},"pins":[{"id":"P","net":"P15"},{"id":"N","net":"SGND"}],"source_evidence":[{"claim":"The cumulative chassis operates from +15 V relative to signal ground.","label":"verified","source_id":"SRC.CAPSTONE.W09"}],"state_class":"persistent-installed","value":"15"},{"id":"INF.PWR_ENTRY.VN15","kind":"voltage_source","model_bindings":{"ideal":"MODEL.W09.V.I"},"module_id":"INF.PWR_ENTRY","parameters":{"physical_supply_detail":"separate permanent infrastructure sheet","polarity":"positive=SGND,negative=N15","role":"ideal simulation rail source"},"pins":[{"id":"P","net":"SGND"},{"id":"N","net":"N15"}],"source_evidence":[{"claim":"The cumulative chassis operates from -15 V relative to signal ground.","label":"verified","source_id":"SRC.CAPSTONE.W09"}],"state_class":"persistent-installed","value":"15"},{"id":"AMP1.Q1","kind":"bjt","model_bindings":{"ideal":"MODEL.W09.NPN.I"},"module_id":"AMP1","parameters":{"historical_type":"2N5963","package_pin_map":"TBD","selected_pair":"AMP1.Q2"},"pins":[{"id":"C","net":"AMP1.N.Q1C_Q4B"},{"id":"B","net":"AMP1.INV_IN"},{"id":"E","net":"AMP1.N.TAIL"}],"source_evidence":[{"claim":"Q1 logical C/B/E nets and 2N5963 identity verified; package pins are not specified.","label":"verified","source_id":"SRC.W09.ADJUDICATION"}],"state_class":"persistent-installed"},{"id":"AMP1.Q2","kind":"bjt","model_bindings":{"ideal":"MODEL.W09.NPN.I"},"module_id":"AMP1","parameters":{"historical_type":"2N5963","package_pin_map":"TBD","selected_pair":"AMP1.Q1"},"pins":[{"id":"C","net":"AMP1.COMP_A"},{"id":"B","net":"AMP1.NONINV_IN"},{"id":"E","net":"AMP1.N.TAIL"}],"source_evidence":[{"claim":"Q2 logical C/B/E nets and 2N5963 identity verified; package pins are not specified.","label":"verified","source_id":"SRC.W09.ADJUDICATION"}],"state_class":"persistent-installed"},{"id":"AMP1.Q3","kind":"bjt","model_bindings":{"ideal":"MODEL.W09.NPN.I"},"module_id":"AMP1","parameters":{"historical_type":"2N3707","package_pin_map":"TBD"},"pins":[{"id":"C","net":"AMP1.N.TAIL"},{"id":"B","net":"AMP1.N.BIAS_NEG"},{"id":"E","net":"AMP1.N.Q3E_SERIES"}],"source_evidence":[{"claim":"Q3 is the 2N3707 tail current source with verified logical terminals.","label":"verified","source_id":"SRC.W09.ADJUDICATION"}],"state_class":"persistent-installed"},{"id":"AMP1.Q4","kind":"bjt","model_bindings":{"ideal":"MODEL.W09.PNP.I"},"module_id":"AMP1","parameters":{"historical_type":"2N4250","matched_pair":"AMP1.Q5","package_pin_map":"TBD"},"pins":[{"id":"C","net":"SGND"},{"id":"B","net":"AMP1.N.Q1C_Q4B"},{"id":"E","net":"AMP1.N.Q45E"}],"source_evidence":[{"claim":"Q4 logical terminals and matched 2N4250 identity verified.","label":"verified","source_id":"SRC.W09.ADJUDICATION"}],"state_class":"persistent-installed"},{"id":"AMP1.Q5","kind":"bjt","model_bindings":{"ideal":"MODEL.W09.PNP.I"},"module_id":"AMP1","parameters":{"historical_type":"2N4250","matched_pair":"AMP1.Q4","package_pin_map":"TBD"},"pins":[{"id":"C","net":"AMP1.N.Q5C_Q6E"},{"id":"B","net":"AMP1.COMP_A"},{"id":"E","net":"AMP1.N.Q45E"}],"source_evidence":[{"claim":"Q5 base is COMP_A; logical terminals and matched 2N4250 identity verified.","label":"verified","source_id":"SRC.W09.ADJUDICATION"}],"state_class":"persistent-installed"},{"id":"AMP1.Q6","kind":"bjt","model_bindings":{"ideal":"MODEL.W09.PNP.I"},"module_id":"AMP1","parameters":{"historical_type":"2N4250","package_pin_map":"TBD"},"pins":[{"id":"C","net":"AMP1.N.HIGH_Z"},{"id":"B","net":"AMP1.N.Q6B"},{"id":"E","net":"AMP1.N.Q5C_Q6E"}],"source_evidence":[{"claim":"Q6 cascode logical terminals and 2N4250 identity verified.","label":"verified","source_id":"SRC.W09.ADJUDICATION"}],"state_class":"persistent-installed"},{"id":"AMP1.Q7","kind":"bjt","model_bindings":{"ideal":"MODEL.W09.NPN.I"},"module_id":"AMP1","parameters":{"historical_type":"2N3707","package_pin_map":"TBD"},"pins":[{"id":"C","net":"AMP1.N.HIGH_Z"},{"id":"B","net":"AMP1.N.BIAS_NEG"},{"id":"E","net":"AMP1.N.Q7E"}],"source_evidence":[{"claim":"Q7 current-source logical terminals and 2N3707 identity verified.","label":"verified","source_id":"SRC.W09.ADJUDICATION"}],"state_class":"persistent-installed"},{"id":"AMP1.Q8","kind":"jfet","model_bindings":{"ideal":"MODEL.W09.NJF.I"},"module_id":"AMP1","parameters":{"historical_type":"TIS58","package_pin_map":"TBD"},"pins":[{"id":"D","net":"P15"},{"id":"G","net":"AMP1.N.HIGH_Z"},{"id":"S","net":"AMP1.COMP_B"}],"source_evidence":[{"claim":"Q8 source is COMP_B; logical D/G/S and TIS58 identity verified.","label":"verified","source_id":"SRC.W09.ADJUDICATION"}],"state_class":"persistent-installed"},{"id":"AMP1.Q9","kind":"bjt","model_bindings":{"ideal":"MODEL.W09.NPN.I"},"module_id":"AMP1","parameters":{"historical_type":"2N3707","package_pin_map":"TBD"},"pins":[{"id":"C","net":"AMP1.N.DRV_N_Q9C"},{"id":"B","net":"AMP1.N.BIAS_NEG"},{"id":"E","net":"AMP1.N.Q9E"}],"source_evidence":[{"claim":"Q9 current-source logical terminals and 2N3707 identity verified.","label":"verified","source_id":"SRC.W09.ADJUDICATION"}],"state_class":"persistent-installed"},{"id":"AMP1.Q10","kind":"bjt","model_bindings":{"ideal":"MODEL.W09.NPN.I"},"module_id":"AMP1","parameters":{"historical_type":"2N2219","package_pin_map":"TBD"},"pins":[{"id":"C","net":"P15"},{"id":"B","net":"AMP1.COMP_B"},{"id":"E","net":"AMP1.N.OUT_P_SENSE"}],"source_evidence":[{"claim":"Q10 logical terminals and 2N2219 identity verified.","label":"verified","source_id":"SRC.W09.ADJUDICATION"}],"state_class":"persistent-installed"},{"id":"AMP1.Q11","kind":"bjt","model_bindings":{"ideal":"MODEL.W09.PNP.I"},"module_id":"AMP1","parameters":{"historical_type":"2N2905","package_pin_map":"TBD"},"pins":[{"id":"C","net":"N15"},{"id":"B","net":"AMP1.N.DRV_N_Q9C"},{"id":"E","net":"AMP1.N.OUT_N_SENSE"}],"source_evidence":[{"claim":"Q11 logical terminals and exact 2N2905 identity verified; 2N2905A is not silently substituted.","label":"verified","source_id":"SRC.W09.ADJUDICATION"}],"state_class":"persistent-installed"},{"id":"AMP1.Q12","kind":"bjt","model_bindings":{"ideal":"MODEL.W09.NPN.I"},"module_id":"AMP1","parameters":{"historical_type":"2N3707","package_pin_map":"TBD"},"pins":[{"id":"C","net":"AMP1.COMP_B"},{"id":"B","net":"AMP1.N.OUT_P_SENSE"},{"id":"E","net":"AMP1.OUT"}],"source_evidence":[{"claim":"Q12 positive limiter logical terminals and 2N3707 identity verified.","label":"verified","source_id":"SRC.W09.ADJUDICATION"}],"state_class":"persistent-installed"},{"id":"AMP1.Q13","kind":"bjt","model_bindings":{"ideal":"MODEL.W09.PNP.I"},"module_id":"AMP1","parameters":{"historical_type":"2N4250","package_pin_map":"TBD"},"pins":[{"id":"C","net":"AMP1.N.DRV_N_Q9C"},{"id":"B","net":"AMP1.N.OUT_N_SENSE"},{"id":"E","net":"AMP1.OUT"}],"source_evidence":[{"claim":"Q13 negative limiter logical terminals and 2N4250 identity verified.","label":"verified","source_id":"SRC.W09.ADJUDICATION"}],"state_class":"persistent-installed"},{"id":"AMP1.R_COL_L","kind":"resistor","model_bindings":{"ideal":"MODEL.W09.R.I"},"module_id":"AMP1","parameters":{"technology":"metal_film","tolerance":"1%"},"pins":[{"id":"P","net":"AMP1.N.BAL_L"},{"id":"N","net":"AMP1.N.Q1C_Q4B"}],"source_evidence":[{"claim":"Left 300 kohm collector resistor has a 1% metal-film dot.","label":"verified","source_id":"SRC.ROBERGE.FIG9_1"}],"state_class":"persistent-installed","value":"300k"},{"id":"AMP1.R_COL_R","kind":"resistor","model_bindings":{"ideal":"MODEL.W09.R.I"},"module_id":"AMP1","parameters":{"technology":"metal_film","tolerance":"1%"},"pins":[{"id":"P","net":"AMP1.N.BAL_R"},{"id":"N","net":"AMP1.COMP_A"}],"source_evidence":[{"claim":"Right 300 kohm collector resistor has a 1% metal-film dot.","label":"verified","source_id":"SRC.ROBERGE.FIG9_1"}],"state_class":"persistent-installed","value":"300k"},{"id":"AMP1.R_BAL_L","kind":"resistor","model_bindings":{"ideal":"MODEL.W09.R.I"},"module_id":"AMP1","parameters":{"physical_identity":"AMP1.R_BAL","physical_total":"50k","position_default":0.5,"segment":"left-to-wiper"},"pins":[{"id":"P","net":"AMP1.N.BAL_L"},{"id":"N","net":"AMP1.N.BAL_W"}],"source_evidence":[{"claim":"Electrical segment of the verified 50 kohm three-terminal balance control; 25 kohm is the proposed midpoint topology default.","label":"proposed","source_id":"SRC.W09.ADJUDICATION"}],"state_class":"persistent-installed","value":"25k"},{"id":"AMP1.R_BAL_R","kind":"resistor","model_bindings":{"ideal":"MODEL.W09.R.I"},"module_id":"AMP1","parameters":{"physical_identity":"AMP1.R_BAL","physical_total":"50k","position_default":0.5,"segment":"wiper-to-right"},"pins":[{"id":"P","net":"AMP1.N.BAL_W"},{"id":"N","net":"AMP1.N.BAL_R"}],"source_evidence":[{"claim":"Electrical segment of the verified 50 kohm three-terminal balance control; 25 kohm is the proposed midpoint topology default.","label":"proposed","source_id":"SRC.W09.ADJUDICATION"}],"state_class":"persistent-installed","value":"25k"},{"id":"AMP1.D_BAL","kind":"diode","model_bindings":{"ideal":"MODEL.W09.D.I"},"module_id":"AMP1","parameters":{"historical_type":"TBD","orientation":"anode=P15,cathode=AMP1.N.BAL_W"},"pins":[{"id":"A","net":"P15"},{"id":"K","net":"AMP1.N.BAL_W"}],"source_evidence":[{"claim":"Orientation verified; diode type is absent from source.","label":"tbd","source_id":"SRC.W09.ADJUDICATION"}],"state_class":"persistent-installed"},{"id":"AMP1.C_Q4B_BYP","kind":"capacitor","model_bindings":{"ideal":"MODEL.W09.C.I"},"module_id":"AMP1","pins":[{"id":"P","net":"P15"},{"id":"N","net":"AMP1.N.Q1C_Q4B"}],"source_evidence":[{"claim":"0.01 uF from P15 to Q1 collector/Q4 base verified.","label":"verified","source_id":"SRC.W09.ADJUDICATION"}],"state_class":"persistent-installed","value":"0.01u"},{"id":"AMP1.R_Q45_E","kind":"resistor","model_bindings":{"ideal":"MODEL.W09.R.I"},"module_id":"AMP1","parameters":{"technol